{
  "id": "task-operations",
  "version": "0.2.0",
  "layer": "local",
  "display_name": "Task Operations",
  "description": "Reusable operations pack for turning incoming work into executable task cards and maintaining deterministic shared and per-owner queues.",
  "category": "Operations",
  "author": {"name": "Evidence Lab"},
  "license": "MIT",
  "capabilities": ["task-intake", "task-prioritization", "task-archiving"],
  "selection": {
    "always": false,
    "rules": [
      {
        "id": "general-task-management",
        "priority": 500,
        "when": {"any": {"workflows": ["manage-tasks"]}},
        "reason": "The operator needs to create, triage, assign, prioritize, complete, or archive tasks."
      }
    ]
  },
  "dependencies": [],
  "conflicts": [],
  "runtimes": ["claude-code", "codex"],
  "interface": {
    "short_description": "Create, assign, and rank executable tasks.",
    "long_description": "Turns raw requests into consistent task cards, verifies readiness and role assignments, and maintains deterministic global and per-owner execution order without losing completion history.",
    "capabilities": ["Operations", "Task management"],
    "default_prompt": "Create these tasks, assign the required fields, verify readiness, and update the execution order."
  }
}
