{
  "id": "example-domain",
  "version": "0.1.5",
  "layer": "domain",
  "display_name": "Example Domain",
  "description": "A non-published reference pack that demonstrates the Evidence Lab package structure, routing evaluations, deterministic scripts, and review metadata.",
  "category": "Reference",
  "author": {"name": "Evidence Lab"},
  "license": "MIT",
  "capabilities": ["reference-fixture"],
  "selection": {"always": false, "rules": []},
  "dependencies": [],
  "conflicts": [],
  "runtimes": ["claude-code", "codex"],
  "interface": {
    "short_description": "Inspect the reference Evidence Lab pack.",
    "long_description": "Demonstrates the complete host-neutral pack layout without shipping subject-matter procedures to researchers.",
    "capabilities": ["Reference"],
    "default_prompt": "Show me how an Evidence Lab pack is structured."
  }
}
