{
  "id": "research-images", "version": "0.1.0", "layer": "workflow", "display_name": "Research Images",
  "description": "Research-image inspection with explicit source identity, transformation history, measurement definitions, exclusions, and interpretation boundaries.",
  "category": "Research", "author": {"name": "Evidence Lab"}, "license": "LicenseRef-Evidence-Lab-Proprietary",
  "capabilities": ["research-image-analysis"],
  "selection": {"always": false, "rules": [{"id": "research-image-material", "priority": 300, "when": {"any": {"materials": ["images"]}}, "reason": "Research images need provenance and transformation-aware inspection."}]},
  "dependencies": ["evidence-lab-core"], "conflicts": [], "runtimes": ["claude-code", "codex"],
  "interface": {"short_description": "Inspect research images with traceable provenance.", "long_description": "Records image source, acquisition context, transformations, measurements, exclusions, and the boundary between observation and interpretation.", "capabilities": ["Research", "Vision"], "default_prompt": "Help me inspect these research images without losing provenance."}
}
