{
  "id": "full-research-cycle",
  "version": "1.0.2",
  "layer": "workflow",
  "display_name": "Full Research Cycle",
  "description": "Compatibility entry point for the complete research cycle; installs the focused research-design and literature-publication packs as declared dependencies.",
  "category": "Research",
  "author": {"name": "Evidence Lab"},
  "license": "MIT",
  "capabilities": ["full-research-cycle-compatibility"],
  "selection": {
    "always": false,
    "rules": [
      {
        "id": "full-cycle-workflow",
        "priority": 300,
        "when": {"any": {"workflows": ["full-research-cycle"]}},
        "reason": "The explicit full-cycle route installs both focused workflow packs."
      }
    ]
  },
  "dependencies": ["research-design", "literature-publication"],
  "conflicts": [],
  "runtimes": ["claude-code", "codex"],
  "interface": {
    "short_description": "Install the complete research workflow.",
    "long_description": "Compatibility entry point that installs the focused research-design and literature-publication packs together.",
    "capabilities": ["Research", "Write"],
    "default_prompt": "Help me continue my research from its current stage."
  }
}
