{
  "id": "evidence-lab-core",
  "version": "0.6.0",
  "layer": "core",
  "display_name": "Evidence Lab Core",
  "description": "Agent-first research foundations, fast researcher onboarding, reproducible pack selection, source verification, citation handling, and scientific critical thinking.",
  "category": "Research",
  "author": {"name": "Evidence Lab"},
  "license": "LicenseRef-Evidence-Lab-Proprietary AND MIT AND Apache-2.0",
  "capabilities": ["onboarding", "pack-selection", "installation-lifecycle", "paper-lookup", "citation-management", "critical-thinking"],
  "selection": {"always": true, "rules": []},
  "dependencies": [],
  "conflicts": [],
  "runtimes": ["claude-code", "codex"],
  "interface": {
    "short_description": "Set up a reproducible research workspace.",
    "long_description": "Runs a short chat onboarding, builds a transparent pack plan, and provides the universal evidence and source-handling foundation.",
    "capabilities": ["Interactive", "Research"],
    "default_prompt": "Set up Evidence Lab for my research work."
  }
}
