{
  "id": "quantitative-sciences",
  "version": "0.3.0",
  "layer": "domain",
  "display_name": "Quantitative Sciences",
  "description": "Statistical analysis, power and sample-size planning, uncertainty and units, and publication-grade scientific visualization for quantitative research.",
  "category": "Research",
  "author": {"name": "Evidence Lab"},
  "license": "LicenseRef-Evidence-Lab-Proprietary AND MIT",
  "capabilities": ["statistical-analysis", "statistical-power", "uncertainty-and-units", "scientific-visualization"],
  "selection": {
    "always": false,
    "rules": [
      {
        "id": "quantitative-method",
        "priority": 300,
        "when": {"any": {"methods": ["statistics", "code", "formulas", "mathematical-models"]}},
        "reason": "The stated methods require quantitative analysis or mathematical checks."
      }
    ]
  },
  "dependencies": ["evidence-lab-core"],
  "conflicts": [],
  "runtimes": ["claude-code", "codex"],
  "interface": {
    "short_description": "Analyze quantitative evidence with explicit assumptions.",
    "long_description": "Provides statistical planning and analysis, unit and uncertainty checks, and truthful publication-oriented scientific figures.",
    "capabilities": ["Analyze", "Research"],
    "default_prompt": "Help me plan or verify this quantitative analysis."
  }
}
